{
  "title": "教师009 · 课程安排风险检查",
  "subtitle": "单对象排课风险",
  "timeText": "第1周 · 周一",
  "statusText": "已核验",
  "footerText": "数据源：冲突比较工具 · competition-demo-v1",
  "summary": {
    "conflictCount": 0,
    "rushWarningCount": 1,
    "selfCompare": true,
    "firstBusySlots": 3,
    "secondBusySlots": 3
  },
  "items": [],
  "rushWarnings": [
    {
      "entity": "教师009",
      "date": "2026-08-31",
      "weekdayName": "周一",
      "gapMinutes": 20,
      "from": { "courseName": "操作系统", "periodText": "第3-4节", "campusName": "校区A", "roomName": "A1-201" },
      "to": { "courseName": "编译原理", "periodText": "第5-6节", "campusName": "校区B", "roomName": "B1-102" }
    }
  ],
  "actions": [
    { "id": "conflict-self-day", "type": "sys.chat", "label": "查看当天课表", "message": "查询教师009第1周周一的课" },
    { "id": "conflict-self-week", "type": "sys.chat", "label": "查看整周课表", "message": "查询教师009第1周的课表" }
  ]
}
